{
  "id": "relais-colis",
  "displayName": "Relais Colis",
  "aliases": [
    "Relais Colis (Groupe Ducros)"
  ],
  "region": {
    "countries": [
      "FR"
    ]
  },
  "brand": {
    "color": "#7bb928"
  },
  "selectable": true,
  "timezone": "Europe/Paris",
  "tracking": {
    "mode": "automatic",
    "adapter": "relais-colis",
    "steps": [
      "direct"
    ],
    "recognition": {
      "rank": 25
    }
  },
  "capabilities": [
    "history"
  ],
  "portal": {
    "url": "https://www.relaiscolis.com/colis/suivre?tracking_number={trackingNumber}",
    "canaryUrl": "https://www.relaiscolis.com/colis/suivre",
    "shows": [
      "status",
      "history",
      "recipient_name",
      "recipient_address",
      "pickup_point"
    ],
    "scraped": [
      "status",
      "history"
    ],
    "discarded": [
      "recipient_name",
      "recipient_address",
      "pickup_point"
    ],
    "unavailable": []
  },
  "links": [
    {
      "domains": [
        "relaiscolis.com"
      ],
      "params": [
        "tracking_number",
        "trackingNumber",
        "numeroColis",
        "numColis"
      ]
    }
  ],
  "detection": [
    {
      "id": "relais-colis-1",
      "pattern": "^CC\\d{10,14}$",
      "confidence": "high"
    },
    {
      "id": "relais-colis-2",
      "pattern": "^\\d{10}$",
      "confidence": "low"
    }
  ]
}
