{
  "id": "speedx",
  "displayName": "SpeedX",
  "aliases": [],
  "region": {
    "countries": [
      "US"
    ]
  },
  "brand": {
    "color": "#1aa3ff"
  },
  "selectable": true,
  "timezone": "UTC",
  "tracking": {
    "mode": "automatic",
    "adapter": "universal",
    "steps": []
  },
  "capabilities": [],
  "portal": {
    "url": "https://tracking.speedx.io/{trackingNumber}",
    "canaryUrl": "https://t.17track.net/",
    "shows": [],
    "scraped": [],
    "discarded": [],
    "unavailable": []
  },
  "links": [
    {
      "domains": [
        "tracking.speedx.io"
      ],
      "path": "^/([^/?#]+)/?$"
    }
  ],
  "detection": [
    {
      "id": "speedx-1",
      "pattern": "^SPX[A-Z]{3}\\d{12}$",
      "confidence": "high"
    }
  ]
}
