{
  "id": "dhl",
  "displayName": "DHL",
  "aliases": [
    "DHL Paket",
    "Deutsche Post DHL"
  ],
  "region": {
    "countries": [
      "DE"
    ]
  },
  "brand": {
    "color": "#ffcc00",
    "palette": {
      "surface-light": "#f7e8aa",
      "surface-dark": "#514727",
      "ink-light": "#6c5419",
      "ink-dark": "#ead695",
      "brand-light": "#d40511",
      "brand-dark": "#ffe274",
      "truck": "#ffcc00",
      "edge": "#b88d16",
      "accent": "#d40511"
    },
    "decal": "dhl"
  },
  "selectable": true,
  "timezone": "Europe/Berlin",
  "tracking": {
    "mode": "automatic",
    "adapter": "dhl",
    "steps": [
      "direct",
      "trawl"
    ]
  },
  "capabilities": [
    "history",
    "location",
    "eta"
  ],
  "portal": {
    "url": "https://www.dhl.de/en/privatkunden/dhl-sendungsverfolgung.html?piececode={trackingNumber}",
    "canaryUrl": "https://www.dhl.de/en/privatkunden/dhl-sendungsverfolgung.html",
    "shows": [
      "status",
      "history",
      "location",
      "eta",
      "recipient_name",
      "recipient_address",
      "signature"
    ],
    "scraped": [
      "status",
      "history",
      "location",
      "eta"
    ],
    "discarded": [
      "recipient_name",
      "recipient_address",
      "signature"
    ],
    "unavailable": []
  },
  "links": [
    {
      "domains": [
        "dhl.com",
        "dhl.de",
        "deutschepost.de"
      ],
      "params": [
        "tracking-id",
        "trackingId",
        "piececode"
      ]
    }
  ],
  "detection": [
    {
      "id": "dhl-1",
      "pattern": "^[CL][A-Z]\\d{9}DE$",
      "confidence": "high",
      "checksum": "s10"
    },
    {
      "id": "dhl-2",
      "pattern": "^(JJD|JVGL)[A-Z0-9]{8,}$",
      "confidence": "high"
    },
    {
      "id": "dhl-3",
      "pattern": "^\\d{10}$",
      "confidence": "low"
    },
    {
      "id": "dhl-4",
      "pattern": "^JD\\d{18}$",
      "confidence": "high"
    },
    {
      "id": "dhl-5",
      "pattern": "^00340434\\d{12}$",
      "confidence": "high"
    }
  ]
}
