{
  "id": "bring-posten",
  "displayName": "Bring",
  "aliases": [
    "Posten Norge",
    "Posten Bring"
  ],
  "region": {
    "countries": [
      "NO",
      "SE",
      "DK",
      "FI"
    ]
  },
  "brand": {
    "color": "#56b529"
  },
  "selectable": true,
  "timezone": "UTC",
  "tracking": {
    "mode": "automatic",
    "adapter": "universal",
    "steps": []
  },
  "capabilities": [],
  "portal": {
    "url": "https://tracking.bring.com/tracking",
    "canaryUrl": "https://t.17track.net/",
    "shows": [],
    "scraped": [],
    "discarded": [],
    "unavailable": []
  },
  "links": [],
  "detection": [
    {
      "id": "bring-posten-1",
      "pattern": "^[A-Z]{2}\\d{9}NO$",
      "confidence": "high",
      "checksum": "s10"
    }
  ]
}
