{
  "id": "la-poste",
  "displayName": "La Poste / Colissimo",
  "aliases": [
    "Colissimo"
  ],
  "region": {
    "countries": [
      "FR"
    ]
  },
  "brand": {
    "color": "#ffcf00",
    "decal": "la-poste",
    "palette": {
      "accent": "#003da5",
      "brand-light": "#003da5"
    }
  },
  "selectable": true,
  "timezone": "Europe/Paris",
  "tracking": {
    "mode": "automatic",
    "adapter": "la-poste",
    "steps": [
      "direct",
      "retry"
    ]
  },
  "capabilities": [
    "history",
    "location",
    "eta",
    "provider_code"
  ],
  "portal": {
    "url": "https://www.laposte.fr/outils/suivre-vos-envois?code={trackingNumber}",
    "canaryUrl": "https://www.laposte.fr/outils/suivre-vos-envois",
    "shows": [
      "status",
      "history",
      "location",
      "eta",
      "recipient_name",
      "recipient_address"
    ],
    "scraped": [
      "status",
      "history",
      "location",
      "eta"
    ],
    "discarded": [
      "recipient_name",
      "recipient_address"
    ],
    "unavailable": []
  },
  "links": [
    {
      "domains": [
        "laposte.fr"
      ],
      "params": [
        "code",
        "idShip",
        "idship"
      ]
    }
  ],
  "detection": [
    {
      "id": "la-poste-1",
      "pattern": "^[68][A-Z]\\d{11}$",
      "confidence": "high"
    },
    {
      "id": "la-poste-2",
      "pattern": "^[A-Z0-9]{2}\\d{11}$",
      "confidence": "low"
    },
    {
      "id": "la-poste-3",
      "pattern": "^(?!(?:PZ|XU|XW|XY))[A-Z]{2}\\d{9}FR$",
      "confidence": "high",
      "checksum": "s10"
    }
  ]
}
