{
  "id": "usps",
  "displayName": "USPS",
  "aliases": [
    "United States Postal Service"
  ],
  "region": {
    "countries": [
      "US"
    ]
  },
  "brand": {
    "color": "#004b87"
  },
  "selectable": true,
  "timezone": "UTC",
  "tracking": {
    "mode": "automatic",
    "adapter": "usps",
    "steps": [
      "trawl"
    ]
  },
  "capabilities": [
    "history",
    "location",
    "eta"
  ],
  "portal": {
    "url": "https://tools.usps.com/go/TrackConfirmAction?tLabels={trackingNumber}",
    "canaryUrl": "https://www.usps.com/",
    "shows": [
      "status",
      "history",
      "eta",
      "location"
    ],
    "scraped": [
      "status",
      "history",
      "eta",
      "location"
    ],
    "discarded": [
      "signatory",
      "delivery instructions",
      "tracking plus upsells"
    ],
    "unavailable": []
  },
  "links": [
    {
      "domains": [
        "tools.usps.com",
        "usps.com"
      ],
      "params": [
        "tLabels"
      ]
    }
  ],
  "detection": [
    {
      "id": "usps-1",
      "pattern": "^\\d{20}$",
      "confidence": "low"
    },
    {
      "id": "usps-2",
      "pattern": "^\\d{22}$",
      "confidence": "low"
    }
  ]
}
