{
  "id": "swiss-post",
  "displayName": "Swiss Post",
  "aliases": [
    "Die Post",
    "La Poste Suisse",
    "La Posta Svizzera",
    "Swiss Post Ltd"
  ],
  "region": {
    "countries": [
      "CH",
      "LI"
    ]
  },
  "brand": {
    "color": "#ffcc00"
  },
  "selectable": true,
  "timezone": "Europe/Zurich",
  "tracking": {
    "mode": "automatic",
    "adapter": "swiss-post",
    "steps": [
      "direct"
    ]
  },
  "capabilities": [
    "history",
    "location",
    "eta",
    "provider_code"
  ],
  "portal": {
    "url": "https://service.post.ch/ekp-web/ui/entry/search/{trackingNumber}",
    "canaryUrl": "https://service.post.ch/",
    "shows": [
      "status",
      "history",
      "location",
      "eta",
      "eta_window",
      "recipient_name",
      "recipient_address",
      "signature",
      "delivery_instructions"
    ],
    "scraped": [
      "status",
      "history",
      "location",
      "eta",
      "provider_code"
    ],
    "discarded": [
      "recipient_name",
      "recipient_address",
      "signature",
      "delivery_instructions"
    ],
    "unavailable": []
  },
  "links": [
    {
      "domains": [
        "service.post.ch"
      ],
      "path": "/entry/search/([^/?#]+)"
    }
  ],
  "detection": [
    {
      "id": "swiss-post-1",
      "pattern": "^[A-Z]{2}\\d{9}CH$",
      "confidence": "high",
      "checksum": "s10"
    },
    {
      "id": "swiss-post-2",
      "pattern": "^9[89]\\d{16}$",
      "confidence": "high"
    }
  ]
}
