{
  "id": "correos-spain",
  "displayName": "Correos",
  "aliases": [
    "Correos España",
    "Correos y Telégrafos",
    "Sociedad Estatal Correos y Telégrafos"
  ],
  "region": {
    "countries": [
      "ES"
    ]
  },
  "brand": {
    "color": "#ffcd00",
    "palette": {
      "accent": "#002e6d",
      "brand-light": "#002e6d"
    }
  },
  "selectable": true,
  "timezone": "UTC",
  "tracking": {
    "mode": "automatic",
    "adapter": "correos-spain",
    "steps": [
      "direct"
    ]
  },
  "capabilities": [
    "history",
    "pickup_point",
    "weight",
    "dimensions",
    "delivered_at"
  ],
  "portal": {
    "url": "https://www.correos.es/es/es/herramientas/localizador/envios/detalle?tracking-number={trackingNumber}",
    "canaryUrl": "https://www.correos.es/",
    "shows": [
      "status",
      "history",
      "recipient_name",
      "recipient_address",
      "signature",
      "weight",
      "dimensions",
      "pickup_point"
    ],
    "scraped": [
      "status",
      "history",
      "weight",
      "dimensions",
      "pickup_point",
      "delivered_at"
    ],
    "discarded": [
      "recipient_name",
      "recipient_address",
      "signature"
    ],
    "unavailable": [
      "eta",
      "location"
    ]
  },
  "links": [
    {
      "domains": [
        "correos.es"
      ],
      "params": [
        "tracking-number"
      ]
    }
  ],
  "detection": [
    {
      "id": "correos-spain-1",
      "pattern": "^PR\\d{15}C$",
      "confidence": "high"
    },
    {
      "id": "correos-spain-2",
      "pattern": "^[PD][A-Z][A-Z0-9]{4}\\d{16}[A-Z]$",
      "confidence": "high"
    },
    {
      "id": "correos-spain-3",
      "pattern": "^[A-Z]{2}\\d{9}ES$",
      "confidence": "high",
      "checksum": "s10"
    }
  ]
}
