{
  "id": "austrian-post",
  "displayName": "Austrian Post",
  "aliases": [],
  "region": {
    "countries": []
  },
  "brand": {
    "color": "#ffdc00",
    "palette": {
      "accent": "#1a1a1a",
      "brand-light": "#1a1a1a"
    }
  },
  "selectable": true,
  "timezone": "UTC",
  "tracking": {
    "mode": "automatic",
    "adapter": "universal",
    "steps": []
  },
  "capabilities": [],
  "portal": {
    "url": "https://www.post.at/en/s/track-and-trace-search",
    "canaryUrl": "https://t.17track.net/",
    "shows": [],
    "scraped": [],
    "discarded": [],
    "unavailable": []
  },
  "links": [],
  "detection": [
    {
      "id": "austrian-post-1",
      "pattern": "^\\d{22}$",
      "confidence": "low"
    },
    {
      "id": "austrian-post-2",
      "pattern": "^[A-Z]{2}\\d{9}AT$",
      "confidence": "high",
      "checksum": "s10"
    }
  ]
}
