{
  "id": "hermes",
  "displayName": "Hermes Einrichtungs-Service",
  "aliases": [
    "HES",
    "Hermes Einrichtungsservice"
  ],
  "region": {
    "countries": [
      "DE"
    ]
  },
  "brand": {
    "color": "#0091cd"
  },
  "selectable": true,
  "timezone": "Europe/Berlin",
  "tracking": {
    "mode": "automatic",
    "adapter": "hermes",
    "steps": [
      "direct"
    ]
  },
  "capabilities": [
    "history",
    "eta"
  ],
  "portal": {
    "url": "https://myhes.de/",
    "canaryUrl": "https://myhes.de/",
    "shows": [
      "status",
      "history",
      "eta",
      "sender_name",
      "recipient_name",
      "recipient_address",
      "delivery_instructions"
    ],
    "scraped": [
      "status",
      "history",
      "eta"
    ],
    "discarded": [
      "sender_name",
      "recipient_name",
      "recipient_address",
      "delivery_instructions"
    ],
    "unavailable": [
      "location"
    ]
  },
  "links": [],
  "detection": []
}
