{
  "id": "gofo",
  "displayName": "GOFO Express",
  "aliases": [],
  "region": {
    "countries": [
      "US"
    ]
  },
  "brand": {
    "color": "#fc4c02"
  },
  "selectable": true,
  "timezone": "UTC",
  "tracking": {
    "mode": "automatic",
    "adapter": "gofo",
    "steps": [
      "direct"
    ]
  },
  "capabilities": [
    "history",
    "location",
    "delivered_at"
  ],
  "portal": {
    "url": "https://www.gofo.com/us/track?searchID={trackingNumber}",
    "canaryUrl": "https://www.gofo.com/us/track",
    "shows": [
      "status",
      "history",
      "location",
      "delivered_at",
      "eta"
    ],
    "scraped": [
      "status",
      "history",
      "location",
      "delivered_at"
    ],
    "discarded": [
      "delivery_detail",
      "proof_images",
      "coordinates",
      "departments",
      "unlabelled_weight",
      "eta"
    ],
    "unavailable": []
  },
  "links": [
    {
      "domains": [
        "gofoexpress.com"
      ],
      "params": [
        "searchID"
      ]
    },
    {
      "domains": [
        "gofo.com"
      ],
      "path": "^/us/track/?$",
      "params": [
        "searchID"
      ]
    }
  ],
  "detection": [
    {
      "id": "gofo-1",
      "pattern": "^GFUS\\d{14}$",
      "confidence": "high"
    }
  ]
}
