{
  "id": "correos-express",
  "displayName": "Correos Express",
  "aliases": [],
  "region": {
    "countries": [
      "ES",
      "PT"
    ]
  },
  "brand": {
    "color": "#ffcd00",
    "palette": {
      "accent": "#002e6d",
      "brand-light": "#002e6d"
    }
  },
  "selectable": true,
  "timezone": "UTC",
  "tracking": {
    "mode": "automatic",
    "adapter": "correos-express",
    "steps": ["direct"],
    "recognition": { "rank": 35 }
  },
  "capabilities": ["history", "location", "eta"],
  "portal": {
    "url": "https://s.correosexpress.com/",
    "canaryUrl": "https://s.correosexpress.com/",
    "shows": ["status", "history", "location", "estimated_delivery", "proof_of_delivery"],
    "scraped": ["status", "history", "location", "estimated_delivery"],
    "discarded": ["proof_of_delivery", "contact_details", "delivery_comments"],
    "unavailable": ["offset_timestamps"]
  },
  "links": [],
  "detection": [
    {
      "id": "correos-express-1",
      "pattern": "^\\d{16}$",
      "confidence": "low"
    }
  ]
}
