{
  "id": "yto",
  "displayName": "YTO Express",
  "aliases": [],
  "region": {
    "countries": []
  },
  "brand": {
    "color": "#4d148c"
  },
  "selectable": true,
  "timezone": "Asia/Shanghai",
  "tracking": {
    "mode": "automatic",
    "adapter": "universal",
    "steps": []
  },
  "capabilities": [],
  "portal": {
    "url": "https://www.ytoglobal.com/",
    "canaryUrl": "https://t.17track.net/",
    "shows": [],
    "scraped": [],
    "discarded": [],
    "unavailable": []
  },
  "links": [],
  "detection": [
    {
      "id": "yto-1",
      "pattern": "^D\\d{11}$",
      "confidence": "high"
    },
    {
      "id": "yto-2",
      "pattern": "^YT\\d{13}$",
      "confidence": "high"
    }
  ]
}
