{
  "id": "spring-gds",
  "displayName": "PostNL",
  "aliases": [
    "Spring GDS",
    "Mailing Technology"
  ],
  "region": {
    "countries": [
      "NL"
    ]
  },
  "brand": {
    "color": "#ef7d00",
    "decal": "postnl"
  },
  "selectable": true,
  "timezone": "Europe/Amsterdam",
  "tracking": {
    "mode": "automatic",
    "adapter": "spring-gds",
    "steps": [
      "direct"
    ]
  },
  "capabilities": [
    "history",
    "location",
    "sender_name",
    "delivered_at"
  ],
  "portal": {
    "url": "https://postnl.post/track?barcodes={trackingNumber}",
    "canaryUrl": "https://postnl.post/",
    "shows": [
      "status",
      "history",
      "sender_name"
    ],
    "scraped": [
      "status",
      "history",
      "sender_name"
    ],
    "discarded": [],
    "unavailable": []
  },
  "links": [
    {
      "domains": [
        "postnl.post"
      ],
      "pathPattern": "^/track/?$",
      "params": [
        "barcodes"
      ]
    },
    {
      "domains": [
        "mailingtechnology.com"
      ],
      "pathPattern": "^/tracking/?$",
      "params": [
        "tn"
      ]
    },
    {
      "domains": [
        "postnl.post"
      ],
      "path": "/details/([^/?#]+)"
    }
  ],
  "detection": [
    {
      "id": "spring-gds-1",
      "pattern": "^(?!(?:PZ|XU|XW|XY))[A-Z]{2}\\d{9}NL$",
      "confidence": "high",
      "checksum": "s10"
    },
    {
      "id": "spring-gds-2",
      "pattern": "^(?=.{13}$|.{15}$)3S[A-Z]{1,4}\\d+$",
      "confidence": "high"
    }
  ]
}
